### ISSUE TITLE
[add] TCP

### ISSUE THREAD

**Issue by nixawk** [nixawk/protocols#2]
```
$ python3 protocols/tcp.py
Transmission Control Protocol, Src Port: 0, Dst Port: 0, Seq: 0, Ack: 0, len: 0
Source Port: 0
Destination Port: 0
TCP Segment Len: 0
Sequence number: 0
Acknowledgment number: 0
Header Length: 20
Flags: 0x02
Window size: 65535
Checksum: 0x0000
Urgent pointer: 0
Transmission Control Protocol, Src Port: 54603, Dst Port: 135, Seq: 0, Ack: 0, len: 0
Source Port: 54603
Destination Port: 135
TCP Segment Len: 0
Sequence number: 0
Acknowledgment number: 0
Header Length: 44
Flags: 0x02
Window size: 65535
Checksum: 0xf5e7
Urgent pointer: 0
```

```
$ python2.7 protocols/tcp.py
Transmission Control Protocol, Src Port: 0, Dst Port: 0, Seq: 0, Ack: 0, len: 0
Source Port: 0
Destination Port: 0
TCP Segment Len: 0
Sequence number: 0
Acknowledgment number: 0
Header Length: 20
Flags: 0x02
Window size: 65535
Checksum: 0x0000
Urgent pointer: 0
Transmission Control Protocol, Src Port: 54603, Dst Port: 135, Seq: 0, Ack: 0, len: 0
Source Port: 54603
Destination Port: 135
TCP Segment Len: 0
Sequence number: 0
Acknowledgment number: 0
Header Length: 44
Flags: 0x02
Window size: 65535
Checksum: 0xf5e7
Urgent pointer: 0
```

```
$ ipython
Python 3.6.0 (v3.6.0:41df79263a11, Dec 22 2016, 17:23:13)
Type 'copyright', 'credits' or 'license' for more information
IPython 6.1.0 -- An enhanced Interactive Python. Type '?' for help.

In [1]: from protocols import tcp

In [2]: mytcp = tcp.TCP()

In [3]: bindata = b'\xd5\x4b\x00\x87\x82\xee\x99\xe5\x00\x00\x00\x00\xb0\xc2\xff\xff\xf5\xe7\x00\x00\x02\x04\x05\xb4\x01\x03\x03\x05\x01\x01\x08\x0a\x2a\x9d\x05\x4c\x00\x00\x00\x
   ...: 00\x04\x02\x00\x00'

In [4]: newtcp = mytcp.unpack(bindata)

In [5]: newtcp.tcp_sport
Out[5]: 54603

In [6]: newtcp.tcp_dport
Out[6]: 135

In [7]: newtcp.wireshark_print()
Transmission Control Protocol, Src Port: 54603, Dst Port: 135, Seq: 0, Ack: 0, len: 0
Source Port: 54603
Destination Port: 135
TCP Segment Len: 0
Sequence number: 0
Acknowledgment number: 0
Header Length: 44
Flags: 0x02
Window size: 65535
Checksum: 0xf5e7
Urgent pointer: 0
```

**Comment by nixawk** [comment]
- How to calc tcp checksum ?
- How to calc relative tcp seq num ?
